{
  "source_ref": "00_raw_extract.json",
  "analysis_meta": {
    "pass": "INDIVIDUAL_QUALITY",
    "model": "claude-sonnet-4-6",
    "prompt_version": "1.0",
    "timestamp": "2026-03-19T06:34:07.612621+00:00",
    "doc_version": null
  },
  "findings": [
    {
      "gen_find_id": "GF-0A54B5",
      "pass": "INDIVIDUAL_QUALITY",
      "type": "FINDING",
      "category": "OVERCONSTRAINT",
      "severity": "MAJOR",
      "affected_items": [
        {
          "gen_uid": "196CB2AF",
          "item_id": "SYS-FUNC-001",
          "gen_hierarchy_number": "G3.1-001",
          "role": "primary"
        }
      ],
      "description": "SYS-FUNC-001 prescribes the implementation technology 'SLAM' rather than stating the functional need (autonomous 2D indoor map generation). SLAM is one specific algorithm family; mandating it at system level overconstrains the design without stating a safety or performance justification.",
      "recommendation": "Rewrite to state the need: 'The system shall autonomously generate a 2D indoor map of the operating environment.' If SLAM is a genuine design constraint, document the rationale in a separate architectural decision record.",
      "reference": "ISO/IEC/IEEE 29148:2018 §6.2.5.2 (requirements should be implementation-independent)",
      "confidence": 0.85,
      "disposition": {
        "status": "OPEN",
        "author_note": null,
        "resolved_in_version": null,
        "reviewed_by": null,
        "review_date": null
      }
    },
    {
      "gen_find_id": "GF-748C20",
      "pass": "INDIVIDUAL_QUALITY",
      "type": "FINDING",
      "category": "COMPLETENESS",
      "severity": "MAJOR",
      "affected_items": [
        {
          "gen_uid": "7353E5BA",
          "item_id": "SYS-FUNC-002",
          "gen_hierarchy_number": "G3.1-002",
          "role": "primary"
        }
      ],
      "description": "SYS-FUNC-002 specifies ±5 cm localization accuracy but omits: (a) the reference frame or coordinate system, (b) operating conditions (open space vs. cluttered room, lighting, map quality), (c) whether this applies to the initial pose estimate or continuous operation, and (d) confidence level or percentage of time the accuracy must be maintained.",
      "recommendation": "Add: operating conditions (e.g., mapped environment with known landmarks), confidence level (e.g., 95th percentile), and reference frame. Example: 'The system shall localize itself within ±5 cm of true position at the 95th percentile under normal indoor operating conditions within a previously mapped area.'",
      "reference": "ISO/IEC/IEEE 29148:2018 §6.2.5.3",
      "confidence": 0.9,
      "disposition": {
        "status": "OPEN",
        "author_note": null,
        "resolved_in_version": null,
        "reviewed_by": null,
        "review_date": null
      }
    },
    {
      "gen_find_id": "GF-1F604C",
      "pass": "INDIVIDUAL_QUALITY",
      "type": "FINDING",
      "category": "AMBIGUITY",
      "severity": "CRITICAL",
      "affected_items": [
        {
          "gen_uid": "C3FF6F31",
          "item_id": "SYS-FUNC-003",
          "gen_hierarchy_number": "G3.1-003",
          "role": "primary"
        }
      ],
      "description": "SYS-FUNC-003 uses 'real-time' without a numeric bound. The term is undefined in the document and two engineers would assign different timing budgets. Additionally, 'avoid' does not specify minimum clearance distance, detection range, or the maximum speed at which avoidance must be effective.",
      "recommendation": "Replace 'real-time' with a concrete response time (e.g., 'within 200 ms of detection'). Add minimum clearance distance (e.g., '≥ 10 cm from detected obstacles'). Specify the speed envelope over which avoidance must operate.",
      "reference": "ISO/IEC/IEEE 29148:2018 §6.2.5.2; ASPICE SYS.1.BP2",
      "confidence": 0.95,
      "disposition": {
        "status": "OPEN",
        "author_note": null,
        "resolved_in_version": null,
        "reviewed_by": null,
        "review_date": null
      }
    },
    {
      "gen_find_id": "GF-0AD516",
      "pass": "INDIVIDUAL_QUALITY",
      "type": "FINDING",
      "category": "COMPLETENESS",
      "severity": "MAJOR",
      "affected_items": [
        {
          "gen_uid": "DEAEC210",
          "item_id": "SYS-FUNC-004",
          "gen_hierarchy_number": "G3.1-004",
          "role": "primary"
        }
      ],
      "description": "SYS-FUNC-004 states the system shall 'detect cliffs or stairs and prevent falling' but does not specify: (a) minimum detection range or drop depth that triggers detection, (b) the stopping distance or response time after detection, (c) whether the requirement applies at maximum operating speed. Without these, the requirement is not fully testable.",
      "recommendation": "Add quantitative thresholds, e.g., 'The system shall detect a floor drop exceeding 50 mm within 100 mm of the drop edge and halt all drive motion within 200 ms at maximum operating speed.'",
      "reference": "ISO/IEC/IEEE 29148:2018 §6.2.5.3; ISO 26262-3 §5.4.2",
      "confidence": 0.9,
      "disposition": {
        "status": "OPEN",
        "author_note": null,
        "resolved_in_version": null,
        "reviewed_by": null,
        "review_date": null
      }
    },
    {
      "gen_find_id": "GF-3A7B03",
      "pass": "INDIVIDUAL_QUALITY",
      "type": "FINDING",
      "category": "AMBIGUITY",
      "severity": "MAJOR",
      "affected_items": [
        {
          "gen_uid": "81140D44",
          "item_id": "SYS-FUNC-005",
          "gen_hierarchy_number": "G3.1-005",
          "role": "primary"
        }
      ],
      "description": "SYS-FUNC-005 uses the vague term 'segmentation' without defining what constitutes a room boundary, the minimum number of rooms supported, or how room identity is persisted across sessions. 'Support' is also vague — it does not indicate the required behavior.",
      "recommendation": "Define 'room' (e.g., a distinct enclosed area separated by a doorway), specify the minimum number of rooms (e.g., 'up to 10 rooms'), and clarify what segmentation means operationally (e.g., 'label and independently addressable cleaning zones').",
      "reference": "ISO/IEC/IEEE 29148:2018 §6.2.5.2",
      "confidence": 0.85,
      "disposition": {
        "status": "OPEN",
        "author_note": null,
        "resolved_in_version": null,
        "reviewed_by": null,
        "review_date": null
      }
    },
    {
      "gen_find_id": "GF-A31689",
      "pass": "INDIVIDUAL_QUALITY",
      "type": "FINDING",
      "category": "COMPLETENESS",
      "severity": "MAJOR",
      "affected_items": [
        {
          "gen_uid": "A72EFD58",
          "item_id": "SYS-FUNC-011",
          "gen_hierarchy_number": "G3.2-002",
          "role": "primary"
        }
      ],
      "description": "SYS-FUNC-011 requires automatic suction adjustment based on detected floor type but does not specify: (a) which floor types are recognized, (b) the suction levels mapped to each floor type, or (c) response time after detection. The requirement is insufficiently defined for implementation or test.",
      "recommendation": "List the floor types supported (e.g., hard floor, low-pile carpet, high-pile carpet) and the corresponding suction levels (in Pa or as named modes). Reference SYS-FUNC-012 for carpet detection linkage.",
      "reference": "ISO/IEC/IEEE 29148:2018 §6.2.5.3",
      "confidence": 0.9,
      "disposition": {
        "status": "OPEN",
        "author_note": null,
        "resolved_in_version": null,
        "reviewed_by": null,
        "review_date": null
      }
    },
    {
      "gen_find_id": "GF-170722",
      "pass": "INDIVIDUAL_QUALITY",
      "type": "FINDING",
      "category": "ATOMICITY",
      "severity": "MAJOR",
      "affected_items": [
        {
          "gen_uid": "B0A7AF6A",
          "item_id": "SYS-FUNC-023",
          "gen_hierarchy_number": "G3.3-004",
          "role": "primary"
        }
      ],
      "description": "SYS-FUNC-023 bundles two distinct behaviors into one requirement: (1) detecting an empty water tank condition, and (2) notifying the user. These have different failure modes, test cases, and potentially different stakeholder concerns.",
      "recommendation": "Split into two requirements: 'The system shall detect an empty water tank condition.' and 'The system shall notify the user when an empty water tank condition is detected, within [X] seconds.'",
      "reference": "ISO/IEC/IEEE 29148:2018 §6.2.5.4",
      "confidence": 0.9,
      "disposition": {
        "status": "OPEN",
        "author_note": null,
        "resolved_in_version": null,
        "reviewed_by": null,
        "review_date": null
      }
    },
    {
      "gen_find_id": "GF-578169",
      "pass": "INDIVIDUAL_QUALITY",
      "type": "FINDING",
      "category": "COMPLETENESS",
      "severity": "MAJOR",
      "affected_items": [
        {
          "gen_uid": "B0A7AF6A",
          "item_id": "SYS-FUNC-023",
          "gen_hierarchy_number": "G3.3-004",
          "role": "primary"
        }
      ],
      "description": "SYS-FUNC-023 does not specify what action the system shall take (e.g., stop mopping, return to dock) upon detecting an empty water tank. Notification alone may be insufficient for a complete behavioral specification.",
      "recommendation": "Add a requirement (or extend the split requirements) to define the system's response to an empty water tank beyond user notification, e.g., 'The system shall suspend mopping operation upon detection of an empty water tank condition.'",
      "reference": "ISO/IEC/IEEE 29148:2018 §6.2.5.3",
      "confidence": 0.85,
      "disposition": {
        "status": "OPEN",
        "author_note": null,
        "resolved_in_version": null,
        "reviewed_by": null,
        "review_date": null
      }
    },
    {
      "gen_find_id": "GF-8719D8",
      "pass": "INDIVIDUAL_QUALITY",
      "type": "FINDING",